[
  {
    "id": "w001",
    "display": {
      "eastern": {
        "syriac": "ܒܲܝܬܵܐ",
        "latin": "bayta"
      }
    },
    "categories": [
      "everyday_objects"
    ],
    "english": "house"
  },
  {
    "id": "w002",
    "display": {
      "eastern": {
        "syriac": "ܠܲܚܡܵܐ",
        "latin": "lakhma"
      }
    },
    "categories": [
      "foods_drinks"
    ],
    "english": "bread"
  },
  {
    "id": "w003",
    "display": {
      "eastern": {
        "syriac": "ܡܝܐ",
        "latin": "maya"
      }
    },
    "categories": [
      "foods_drinks"
    ],
    "english": "water"
  },
  {
    "id": "w004",
    "display": {
      "eastern": {
        "syriac": "ܝܵܡܵܐ",
        "latin": "yama"
      }
    },
    "categories": [
      "everyday_objects"
    ],
    "english": "sea"
  },
  {
    "id": "w005",
    "display": {
      "eastern": {
        "syriac": "ܫܡܲܝܵܐ",
        "latin": "shmaya"
      }
    },
    "categories": [
      "everyday_objects"
    ],
    "english": "sky"
  },
  {
    "id": "w006",
    "display": {
      "eastern": {
        "syriac": "ܫܸܡܫܵܐ",
        "latin": "shimsha"
      }
    },
    "categories": [
      "everyday_objects"
    ],
    "english": "sun"
  },
  {
    "id": "w007",
    "display": {
      "eastern": {
        "syriac": "ܣܲܗܪܵܐ",
        "latin": "sahra"
      }
    },
    "categories": [
      "everyday_objects"
    ],
    "english": "moon"
  },
  {
    "id": "w008",
    "display": {
      "eastern": {
        "syriac": "ܟܲܘܟ݂ܒ݂ܵܐ",
        "latin": "kawkhva"
      }
    },
    "categories": [
      "everyday_objects"
    ],
    "english": "star"
  },
  {
    "id": "w009",
    "display": {
      "eastern": {
        "syriac": "ܐܝܠܢܐ",
        "latin": "ilana"
      }
    },
    "categories": [
      "everyday_objects"
    ],
    "english": "tree"
  },
  {
    "id": "w010",
    "display": {
      "eastern": {
        "syriac": "ܐܪܥܐ",
        "latin": "ara"
      }
    },
    "categories": [
      "everyday_objects"
    ],
    "english": "earth"
  },
  {
    "id": "w011",
    "display": {
      "eastern": {
        "syriac": "ܚܲܒܘܼܫܵܐ",
        "latin": "khabbusha"
      }
    },
    "categories": [
      "foods_drinks"
    ],
    "english": "apple"
  },
  {
    "id": "w012",
    "display": {
      "eastern": {
        "syriac": "ܡܘܼܙܵܐ",
        "latin": "muza"
      }
    },
    "categories": [
      "foods_drinks"
    ],
    "english": "banana"
  },
  {
    "id": "w013",
    "display": {
      "eastern": {
        "syriac": "ܦܘܼܪܬܩܵܠܵܐ",
        "latin": "purtqala"
      }
    },
    "categories": [
      "foods_drinks"
    ],
    "english": "orange"
  },
  {
    "id": "w014",
    "display": {
      "eastern": {
        "syriac": "ܥܲܢܒ݂ܵܐ",
        "latin": "`anva"
      }
    },
    "categories": [
      "foods_drinks"
    ],
    "english": "grape"
  },
  {
    "id": "w015",
    "display": {
      "eastern": {
        "syriac": "ܬܘܼܬ݂ ܐܲܪܥܵܐ",
        "latin": "tuth ar`ah"
      }
    },
    "categories": [
      "foods_drinks"
    ],
    "english": "strawberry"
  },
  {
    "id": "w016",
    "display": {
      "eastern": {
        "syriac": "ܠܝܼܡܘܿܢܵܐ",
        "latin": "limona"
      }
    },
    "categories": [
      "foods_drinks"
    ],
    "english": "lemon"
  },
  {
    "id": "w017",
    "display": {
      "eastern": {
        "syriac": "ܒܸܨܠܵܐ",
        "latin": "bisla"
      }
    },
    "categories": [
      "foods_drinks"
    ],
    "english": "onion"
  },
  {
    "id": "w018",
    "display": {
      "eastern": {
        "syriac": "ܬܘܼܡܵܐ",
        "latin": "tuma"
      }
    },
    "categories": [
      "foods_drinks"
    ],
    "english": "garlic"
  },
  {
    "id": "w019",
    "display": {
      "eastern": {
        "syriac": "ܛܵܡܵܛܵܐ",
        "latin": "tamata"
      }
    },
    "categories": [
      "foods_drinks"
    ],
    "english": "tomato"
  },
  {
    "id": "w020",
    "display": {
      "eastern": {
        "syriac": "ܟܸܪܬܲܘܦܵܐ",
        "latin": "kirtawpa"
      }
    },
    "categories": [
      "foods_drinks"
    ],
    "english": "potato"
  },
  {
    "id": "w021",
    "display": {
      "eastern": {
        "syriac": "ܓܸܙܵܪܵܐ",
        "latin": "gizzara"
      }
    },
    "categories": [
      "foods_drinks"
    ],
    "english": "carrot"
  },
  {
    "id": "w022",
    "display": {
      "eastern": {
        "syriac": "ܟ݂ܝܵܪܵܐ",
        "latin": "khyara"
      }
    },
    "categories": [
      "foods_drinks"
    ],
    "english": "cucumber"
  },
  {
    "id": "w023",
    "display": {
      "eastern": {
        "syriac": "ܪܘܼܙܵܐ",
        "latin": "ruza"
      }
    },
    "categories": [
      "foods_drinks"
    ],
    "english": "rice"
  },
  {
    "id": "w024",
    "display": {
      "eastern": {
        "syriac": "ܣܵܥܲܬ",
        "latin": "sa`at"
      }
    },
    "categories": [
      "everyday_objects"
    ],
    "english": "clock"
  },
  {
    "id": "w025",
    "display": {
      "eastern": {
        "syriac": "ܟܲܢܘܿܫܬܵܐ",
        "latin": "kanoshta"
      }
    },
    "categories": [
      "everyday_objects"
    ],
    "english": "broom"
  },
  {
    "id": "w026",
    "display": {
      "eastern": {
        "syriac": "ܟܲܟܵܐ",
        "latin": "keeka"
      }
    },
    "categories": [
      "everyday_objects"
    ],
    "english": "window"
  },
  {
    "id": "w027",
    "display": {
      "eastern": {
        "syriac": "ܨܲܘܠܬܵܐ",
        "latin": "sawlta"
      }
    },
    "categories": [
      "everyday_objects"
    ],
    "english": "prayer"
  },
  {
    "id": "w028",
    "display": {
      "eastern": {
        "syriac": "ܟܬ݂ܵܒ݂ܵܐ",
        "latin": "khtava"
      }
    },
    "categories": [
      "school_education"
    ],
    "english": "book"
  },
  {
    "id": "w029",
    "display": {
      "eastern": {
        "syriac": "ܪܲܒܝܼ",
        "latin": "rabee"
      }
    },
    "categories": [
      "school_education"
    ],
    "english": "teacher"
  },
  {
    "id": "w030",
    "display": {
      "eastern": {
        "syriac": "ܢܘܼܪܵܐ",
        "latin": "nura"
      }
    },
    "categories": [
      "everyday_objects"
    ],
    "english": "fire"
  },
  {
    "id": "w031",
    "display": {
      "eastern": {
        "syriac": "ܣܸܬܘܵܐ",
        "latin": "sitwa"
      }
    },
    "categories": [
      "everyday_objects"
    ],
    "english": "winter"
  },
  {
    "id": "w032",
    "display": {
      "eastern": {
        "syriac": "ܟܲܠܒܵܐ",
        "latin": "kalba"
      }
    },
    "categories": [
      "animals"
    ],
    "english": "dog"
  },
  {
    "id": "w033",
    "display": {
      "eastern": {
        "syriac": "ܩܵܛܘܿ",
        "latin": "qato"
      }
    },
    "categories": [
      "animals"
    ],
    "english": "cat"
  },
  {
    "id": "w034",
    "display": {
      "eastern": {
        "syriac": "ܬܲܘܪܬ݂ܵܐ",
        "latin": "tawrtha"
      }
    },
    "categories": [
      "animals"
    ],
    "english": "cow"
  },
  {
    "id": "w035",
    "display": {
      "eastern": {
        "syriac": "ܥܸܪܒܵܐ",
        "latin": "`irba"
      }
    },
    "categories": [
      "animals"
    ],
    "english": "sheep"
  },
  {
    "id": "w036",
    "display": {
      "eastern": {
        "syriac": "ܟܬ݂ܵܝܬܵܐ",
        "latin": "kthayta"
      }
    },
    "categories": [
      "animals"
    ],
    "english": "chicken"
  },
  {
    "id": "w037",
    "display": {
      "eastern": {
        "syriac": "ܩܵܪܘܿܝܵܐ",
        "latin": "qaroya"
      }
    },
    "categories": [
      "animals"
    ],
    "english": "rooster"
  },
  {
    "id": "w038",
    "display": {
      "eastern": {
        "syriac": "ܥܲܟܵܒ݂ܝܼܬ݂ܵܐ",
        "latin": "`akkaveetha"
      }
    },
    "categories": [
      "animals"
    ],
    "english": "spider"
  },
  {
    "id": "w039",
    "display": {
      "eastern": {
        "syriac": "ܚܸܘܘܹܐ",
        "latin": "khiwweh"
      }
    },
    "categories": [
      "animals"
    ],
    "english": "snake"
  },
  {
    "id": "w040",
    "display": {
      "eastern": {
        "syriac": "ܣܟܝܼܢܵܐ",
        "latin": "skeena"
      }
    },
    "categories": [
      "kitchen_cooking"
    ],
    "english": "knife"
  },
  {
    "id": "w041",
    "display": {
      "eastern": {
        "syriac": "ܦܘܼܪܢܵܐ",
        "latin": "purna"
      }
    },
    "categories": [
      "kitchen_cooking"
    ],
    "english": "oven"
  },
  {
    "id": "w042",
    "display": {
      "eastern": {
        "syriac": "ܡܲܡܫܝܼܬ݂ܵܐ",
        "latin": "mamsheetha"
      }
    },
    "categories": [
      "everyday_objects"
    ],
    "english": "mop"
  },
  {
    "id": "w043",
    "display": {
      "eastern": {
        "syriac": "ܦܪܝܼܣܬܵܐ",
        "latin": "prista"
      }
    },
    "categories": [
      "everyday_objects"
    ],
    "english": "rug"
  },
  {
    "id": "w044",
    "display": {
      "eastern": {
        "syriac": "ܥܸܙܲܩܬܵܐ",
        "latin": "`izzaqta"
      }
    },
    "categories": [
      "everyday_objects"
    ],
    "english": "ring"
  },
  {
    "id": "w045",
    "display": {
      "eastern": {
        "syriac": "ܫܸܒܪܬ݂ܵܐ",
        "latin": "shibrtha"
      }
    },
    "categories": [
      "everyday_objects"
    ],
    "english": "bracelet"
  },
  {
    "id": "w046",
    "display": {
      "eastern": {
        "syriac": "ܟ̰ܸܟܲܠܬܵܐ",
        "latin": "chikkalta"
      }
    },
    "categories": [
      "everyday_objects"
    ],
    "english": "sandals"
  },
  {
    "id": "w047",
    "display": {
      "eastern": {
        "syriac": "ܬܵܪܘܿܩܬܵܐ",
        "latin": "taroqta"
      }
    },
    "categories": [
      "everyday_objects"
    ],
    "english": "button"
  },
  {
    "id": "w048",
    "display": {
      "eastern": {
        "syriac": "ܒܹܝܥܬ݂ܵܐ",
        "latin": "beh`tha"
      }
    },
    "categories": [
      "foods_drinks"
    ],
    "english": "egg"
  },
  {
    "id": "w049",
    "display": {
      "eastern": {
        "syriac": "ܒܸܣܪܵܐ",
        "latin": "bisra"
      }
    },